[
  {
    "id": "sig-2026-02-10-zebra-alpha",
    "title": "Zebra alpha fixture headline about synthetic ingest tooling",
    "sourceLanguage": "en",
    "summary": {
      "text": "zebra-alpha-summary: a synthetic paraphrase of a made-up source, used only by the unit tests.",
      "label": "ai-generated"
    },
    "relevanceNote": {
      "text": "zebra-alpha-relevance: a synthetic note on why the fixture team might look at this.",
      "label": "ai-generated"
    },
    "label": "real",
    "provenance": {
      "sourceUrl": "https://example.org/fixture/signal-zebra-alpha",
      "publisher": "Example Gazette",
      "publishedOn": "2026-02-10",
      "retrievedOn": "2026-10-01",
      "producedBy": [
        "scout"
      ],
      "producedOn": "2026-10-04",
      "frozenOn": "2026-10-05"
    }
  },
  {
    "id": "sig-2026-02-10-zebra-beta",
    "title": "Zebra beta fixture headline about synthetic pricing pages",
    "sourceLanguage": "en",
    "summary": {
      "text": "zebra-beta-summary: a synthetic paraphrase of a made-up source, used only by the unit tests.",
      "label": "ai-generated"
    },
    "relevanceNote": {
      "text": "zebra-beta-relevance: a synthetic note on why the fixture team might look at this.",
      "label": "ai-generated"
    },
    "label": "real",
    "provenance": {
      "sourceUrl": "https://example.org/fixture/signal-zebra-beta",
      "publisher": "Example Weekly",
      "publishedOn": "2026-02-10",
      "retrievedOn": "2026-10-01",
      "producedBy": [
        "scout"
      ],
      "producedOn": "2026-10-04",
      "frozenOn": "2026-10-05"
    }
  },
  {
    "id": "sig-2026-03-04-zebra-gamma",
    "title": "Zebra Gamma: synthetischer Normentwurf für Testzwecke",
    "sourceLanguage": "de",
    "summary": {
      "text": "zebra-gamma-summary: a synthetic paraphrase of a made-up source, used only by the unit tests.",
      "label": "ai-generated"
    },
    "relevanceNote": {
      "text": "zebra-gamma-relevance: a synthetic note on why the fixture team might look at this.",
      "label": "ai-generated"
    },
    "label": "real",
    "provenance": {
      "sourceUrl": "https://example.org/fixture/signal-zebra-gamma",
      "publisher": "Beispiel Fachblatt",
      "publishedOn": "2026-03-04",
      "retrievedOn": "2026-10-01",
      "producedBy": [
        "scout"
      ],
      "producedOn": "2026-10-04",
      "frozenOn": "2026-10-05"
    }
  },
  {
    "id": "sig-2026-05-20-zebra-delta",
    "title": "Zebra delta fixture headline about a synthetic rule draft",
    "sourceLanguage": "en",
    "summary": {
      "text": "zebra-delta-summary: a synthetic paraphrase of a made-up source, used only by the unit tests.",
      "label": "ai-generated"
    },
    "relevanceNote": {
      "text": "zebra-delta-relevance: a synthetic note on why the fixture team might look at this.",
      "label": "ai-generated"
    },
    "label": "real",
    "provenance": {
      "sourceUrl": "https://example.org/fixture/signal-zebra-delta",
      "publisher": "Example Gazette",
      "publishedOn": "2026-05-20",
      "retrievedOn": "2026-10-01",
      "producedBy": [
        "scout"
      ],
      "producedOn": "2026-10-04",
      "frozenOn": "2026-10-05"
    },
    "quote": "zebra delta quote one two three four five six seven eight nine ten eleven twelve"
  },
  {
    "id": "sig-2026-06-15-zebra-epsilon",
    "title": "Zebra epsilon fixture headline about synthetic hiring notes",
    "sourceLanguage": "en",
    "summary": {
      "text": "zebra-epsilon-summary: a synthetic paraphrase of a made-up source, used only by the unit tests.",
      "label": "ai-generated"
    },
    "relevanceNote": {
      "text": "zebra-epsilon-relevance: a synthetic note on why the fixture team might look at this.",
      "label": "ai-generated"
    },
    "label": "real",
    "provenance": {
      "sourceUrl": "https://example.org/fixture/signal-zebra-epsilon",
      "publisher": "Example Weekly",
      "publishedOn": "2026-06-15",
      "retrievedOn": "2026-10-01",
      "producedBy": [
        "scout"
      ],
      "producedOn": "2026-10-04",
      "frozenOn": "2026-10-05"
    }
  },
  {
    "id": "sig-2025-11-02-zebra-zeta",
    "title": "Zebra zeta fixture headline from before the synthetic window",
    "sourceLanguage": "en",
    "summary": {
      "text": "zebra-zeta-summary: a synthetic paraphrase of a made-up source, used only by the unit tests.",
      "label": "ai-generated"
    },
    "relevanceNote": {
      "text": "zebra-zeta-relevance: a synthetic note on why the fixture team might look at this.",
      "label": "ai-generated"
    },
    "label": "real",
    "provenance": {
      "sourceUrl": "https://example.org/fixture/signal-zebra-zeta",
      "publisher": "Example Archive",
      "publishedOn": "2025-11-02",
      "retrievedOn": "2026-10-01",
      "producedBy": [
        "scout"
      ],
      "producedOn": "2026-10-04",
      "frozenOn": "2026-10-05"
    },
    "windowNote": "Fixture note: published before the window of the synthetic scanning brief."
  }
]
